context,response,label,explanation
어떤 상황에서든지 연장되는 일이 발생하여 불만을 표현하는 상황,이런 일이 계속되면 정말 힘들어질 것 같아요.,Non-Sarcasm,문장이 상황에 대한 진정한 우려를 표현하고 있어 비풍자적입니다.
집안의 사생활이나 사소한 정보까지 외부에 노출되는 상황,우리 집의 사생활이 외부에 알려지는 것은 매우 불편한 일입니다.,Non-Sarcasm,이 문장은 집안의 사생활이 노출되는 것에 대한 진지한 우려를 표현하고 있어 비풍자적입니다.
누나와 외출을 계획하는 상황,누나와 함께 영화 보러 가는 것이 정말 기대돼.,Non-Sarcasm,영화 관람을 기대하는 진심 어린 감정을 표현하고 있어 비풍자적입니다.
동북공정에 관한 역사적 논쟁이 있는 상황,동북공정은 역사적 사실을 바탕으로 한 논의가 필요합니다.,Non-Sarcasm,이 문장은 역사적 논쟁의 중요성을 진지하게 강조하고 있어 비풍자적입니다.
어떤 부끄러운 기사가 해외에 알려질까 걱정하는 상황,"아, 우리나라의 자랑스러운 순간이 또 해외에 소개되겠군요. 외국인들이 감동해서 눈물 흘릴지도 모르겠어요!",Sarcasm,부끄러운 기사를 걱정하는 상황에서 '자랑스러운 순간'과 '외국인들이 감동해서 눈물 흘릴지도 모르겠다'는 표현은 실제로는 부정적인 상황을 비꼬아 말하는 방식이기 때문에 sarcasm이다.
자신의 키와 몸무게에 비해 과도한 비판을 받는 상황,나는 내 몸에 대해 긍정적으로 생각하려고 노력하고 있어요.,Non-Sarcasm,"이 문장은 자신의 몸에 대한 긍정적인 태도를 표현하고 있으며, 비판에 대한 반응으로 진지한 마음가짐을 보여줍니다."
스트레스가 건강에 악영향을 미치는 상황,스트레스를 관리하는 것은 건강을 유지하는 데 매우 중요합니다.,Non-Sarcasm,"이 문장은 스트레스 관리의 중요성을 진지하게 강조하고 있으며, 비꼬는 의미가 없습니다."
"임요환은 매우 경쟁적이고 승부욕이 강한 사람으로 알려져 있으며, 그의 가족도 비슷한 성향을 가지고 있을 것이라는 추측이 담겨 있다.",임요환의 가족도 그와 같은 경쟁적인 성향을 가질 가능성이 높다.,Non-Sarcasm,"이 문장은 임요환의 가족에 대한 추측을 진지하게 전달하고 있으며, 비꼬거나 조롱하는 의도가 없다."
중국과의 관계가 국제적으로 악화되고 있는 상황에서 어떤 인물이 중국과의 친밀함을 강조하면서도 정작 자신의 자식들은 서방 국가에서 교육을 받도록 한 상황,"그는 중국과의 협력을 중요시하지만, 자신의 자식들에게는 더 나은 교육 기회를 제공하고 싶어 한다.",Non-Sarcasm,"이 문장은 인물이 두 가지 상반된 가치를 가지고 있다는 점을 진지하게 설명하고 있으며, 풍자를 포함하지 않고 사실을 전달하고 있습니다."
누군가가 안타까운 상황에 처해 있는 상황,"정말 안타깝네요, 다음엔 로또라도 사보세요!",Sarcasm,"상대방의 불행에 대해 진정한 동정이 아닌, 비꼬는 방식으로 로또를 언급하여 상황의 심각성을 경시하고 있다."
그림을 통해 정치적 성향을 추측하는 상황,"이 그림은 사회적 불평등에 대한 강한 메시지를 전달하고 있어, 작가가 진보적인 정치 성향을 가지고 있을 가능성이 높습니다.",Non-Sarcasm,이 문장은 그림의 메시지에 대한 분석을 통해 정치적 성향을 진지하게 추측하고 있어 비풍자적입니다.
정민씨 사망 사건에 대한 보도가 일부 언론에서 제한되고 있다.,아마도 우리나라 언론은 투명하게 보도하는 것보다 신비로운 침묵을 유지하는 것이 더 멋지다고 생각하나 봐.,Sarcasm,언론의 침묵을 '신비로운'과 '더 멋지다'고 표현함으로써 실제로는 그들의 비윤리적인 행동을 비꼬고 있다.
삼성그룹의 채용 방식 변화가 발표된 상황,삼성그룹이 새로운 채용 방식을 도입하여 더 많은 인재를 발굴할 수 있기를 기대합니다.,Non-Sarcasm,이 문장은 삼성그룹의 변화에 대한 긍정적인 기대를 표현하고 있어 비풍자적입니다.
정권이 범죄에 대해 관대하고 미래가 불안한 상황,이런 상황에서는 시민들이 더욱 안전을 걱정하게 됩니다.,Non-Sarcasm,"이 문장은 현실적인 우려를 표현하고 있으며, 비꼬는 의미가 없이 진지한 사실을 전달하고 있습니다."
어떤 부끄러운 기사가 해외에 알려질까 걱정하는 상황,나는 이 기사가 해외에 알려지지 않기를 진심으로 바라고 있어.,Non-Sarcasm,이 문장은 상대방의 걱정을 진지하게 이해하고 공감하는 표현이기 때문에 비풍자적입니다.
짝사랑하는 상황,그 사람과 함께 시간을 보내고 싶어.,Non-Sarcasm,"이 문장은 진정한 감정을 표현하고 있으며, 상대방에 대한 진지한 관심을 나타내기 때문에 비풍자적입니다."
"친구가 슬픔에 빠져 울다 지쳐 잠들었고, 다른 친구는 이를 가볍게 여기며 위로하러 갈까 고민하는 상황","맞아, 친구가 울다 지쳐 잠들었으니 이제 내가 가서 '위로'라는 이름의 파티를 열어줘야겠네. 정말 위로의 달인이야!",Sarcasm,"친구의 슬픔을 진지하게 받아들이지 않고 가벼운 방식으로 언급하며, 위로의 의미를 비꼬아서 표현하고 있기 때문에 풍자적이다."
정부가 시민의 안전을 이유로 과도한 통제를 시도하는 상황,시민의 안전을 지키기 위한 정부의 노력이 필요합니다.,Non-Sarcasm,"이 문장은 정부의 안전 확보 노력을 긍정적으로 평가하고 있으며, 풍자가 아닌 진정한 의견을 표현하고 있습니다."
어딘가에서 오줌 소리가 들리는데 아무도 이를 해결하지 않고 있는 상황,이 소리를 해결할 방법을 찾아야 할 것 같습니다.,Non-Sarcasm,이 문장은 상황을 진지하게 받아들이고 문제 해결을 제안하고 있기 때문에 비풍자적입니다.
건강 검진 결과에서 예상치 못한 허리 상태를 알게 된 상황,"아, 이제 내가 허리로 날씨 예보까지 할 수 있겠네!",Sarcasm,"허리 상태가 좋지 않다는 사실을 비꼬아, 허리 통증이 날씨 예보에 영향을 미친다는 비현실적인 주장을 통해 상황의 부조리를 강조하고 있다."
화자는 쓸데없는 일에 에너지를 낭비하는 대신 자신과 소중한 사람에게 집중하는 것이 더 낫다고 생각한다.,"나는 중요한 사람들과의 관계를 소중히 여기고, 그들에게 더 많은 시간을 투자해야 한다고 믿는다.",Non-Sarcasm,이 문장은 진지하게 소중한 사람들과의 관계를 우선시하는 가치관을 표현하고 있어 풍자가 아니다.
배송이 너무 느려서 기다리다가 결국 시중에서 물건을 구매한 상황,다음번에는 배송 기다리면서 직접 물건을 만드는 게 더 빠를지도 모르겠네요!,Sarcasm,"실제로 물건을 만드는 것이 배송보다 빠를 리가 없으므로, 이 발언은 배송 지연에 대한 비꼬는 표현이다."
중국 자본이 투자된 영화라서 중국어 사용이 많고 재미가 없다고 느끼는 상황,"아, 이 영화는 중국어 수업을 들으면서 졸린 눈을 뜨게 해주는 최고의 방법이네요!",Sarcasm,영화를 재미없다고 느끼면서도 긍정적인 표현을 사용해 실제로는 부정적인 감정을 드러내고 있어 아이러니함을 나타냅니다.
아기가 좁쌀베개를 불편해하고 잘 사용하지 못하는 상황,아기를 위해 더 편안한 베개를 찾아보는 것이 좋겠어요.,Non-Sarcasm,이 문장은 아기의 편안함을 고려하여 실제로 도움이 될 만한 행동을 제안하고 있기 때문에 비풍자적입니다.
아기가 울고 있는 상황,세상에서 가장 조용한 아기네요!,Sarcasm,아기가 울고 있는 상황에서 '가장 조용한 아기'라는 표현은 반어적으로 사용되어 실제로는 아기가 매우 시끄럽다는 것을 강조하고 있다.
다른 사람들의 행동이나 태도가 마음에 들지 않아 속으로 피하게 되는 상황,"네, 마음속에 거름을 쌓아두면 나중에 비료로 쓸 수 있겠네요.",Sarcasm,상대방의 부정적인 감정을 비유적으로 '비료'로 표현함으로써 상황을 경시하고 비꼬는 어조를 사용하고 있기 때문입니다.
스마트폰 가격이 곧 크게 하락할 예정인 상황,"아, 드디어 은행을 털지 않고도 최신 스마트폰을 구입할 수 있겠군요!",Sarcasm,"최신 스마트폰을 살 수 있게 되었다는 긍정적인 표현이지만, 실제로는 가격 하락이 필요하다는 점을 비꼬고 있어 반어적이다."
이찬혁이 해병가를 작곡하여 경제적 이익을 얻는 상황,이찬혁은 해병가를 통해 많은 사람들에게 감동을 주며 동시에 경제적 성공을 거두고 있습니다.,Non-Sarcasm,"이 문장은 이찬혁의 성과를 긍정적으로 평가하고 있으며, 그의 음악이 사람들에게 미치는 긍정적인 영향을 진지하게 언급하고 있습니다."
"아기 쇼파를 구입했는데, 사진이 어둡게 나왔고 크기가 작지만 색상이 예쁘고 안정감이 있어 만족하는 상황",이 아기 쇼파는 색상이 정말 예쁘고 안정감이 있어서 마음에 들어요.,Non-Sarcasm,긍정적인 감정을 표현하며 실제로 만족감을 나타내고 있기 때문에 비풍자적입니다.
검찰 권력의 남용으로 인해 검찰개혁의 필요성이 대두된 상황,검찰개혁은 법의 공정성을 확보하고 국민의 신뢰를 회복하기 위해 매우 중요합니다.,Non-Sarcasm,"이 문장은 검찰개혁의 필요성을 진지하게 강조하며, 풍자나 비꼼이 없는 진정한 의견을 표현하고 있습니다."
국민이 직접 뽑은 드림내각에서 총리가 국민의 기대와 달리 대통령의 지시에만 따르는 상황,국민이 뽑은 드림내각 덕분에 이제 대통령이 할 일을 총리가 대신 해주니 대통령은 정말 편하겠네요.,Sarcasm,"총리가 대통령의 지시에만 따르는 상황을 비꼬아, 대통령이 편하다는 말로 실제로는 불만을 표현하고 있다."
죽지 않으면 인류의 생존과 번식에 대한 필요성이 없어지는 상황,"맞아요, 죽지 않으면 인류는 그냥 영원히 휴가를 즐기면 되겠네요!",Sarcasm,"이 반응은 죽지 않으면 생존과 번식의 필요성이 사라진다는 맥락을 비꼬아, 현실적으로 불가능한 상황을 유머러스하게 표현하고 있기 때문에 sarcasm입니다."
드라마와 현실의 선악 구분이 명확하지 않은 상황,현실에서도 사람들은 복잡한 감정을 가지고 있기 때문에 선과 악을 단순히 나눌 수 없는 경우가 많습니다.,Non-Sarcasm,이 문장은 드라마와 현실의 복잡성을 진지하게 설명하고 있어 비풍자적입니다.
무언가 기대했던 일이 잘 풀리지 않은 상황,"정말 대단한 하루였어, 모든 계획이 완벽하게 엉망진창이 되었으니까!",Sarcasm,"긍정적인 표현을 사용했지만, 실제로는 부정적인 상황을 비꼬아 표현하고 있어."
캐나다에 오래 살았지만 비싸서 대중교통을 이용해보지 못한 상황,"대중교통이 금으로 만들어졌나 봐요, 타기만 하면 부자가 되는 줄 알았어요!",Sarcasm,"대중교통의 높은 비용에 대한 비꼬는 표현으로, 실제로는 금으로 만들어지지 않았음을 강조하며 상황을 과장하고 있다."
어떤 콘텐츠가 비윤리적이거나 불쾌감을 주는 상황,"아, 그럼 이제부터는 다 같이 싫어하는 법을 배우는 게 유행이겠네요!",Sarcasm,"이 반응은 비윤리적 콘텐츠에 대한 비판을 유머러스하게 표현하며, 진정한 유행이 될 수 없다는 점을 강조하고 있습니다."
최대집이 의사보다는 정치 활동에 더 집중하고 있다는 상황,최대집은 현재 정치 활동에 많은 시간을 할애하고 있어 의료 분야와의 연관성이 줄어들고 있습니다.,Non-Sarcasm,"이 문장은 최대집의 활동을 사실적으로 설명하고 있으며, 비꼬거나 조롱하는 의미가 없기 때문에 비풍자적입니다."
영화 '더 울버린'을 보고 실망한 관객이 '엑스맨3'보다 더 나쁘다고 평가하며 시간을 낭비했다고 느끼고 있다.,나는 '더 울버린'이 기대에 미치지 못해서 매우 실망했다.,Non-Sarcasm,"관객의 실망감과 평가를 진지하게 표현한 문장으로, 비꼬는 요소가 없다."
사람들이 매일 같은 말이나 유행어를 반복해서 사용하는 상황,사람들이 자주 사용하는 유행어는 서로의 소통을 쉽게 해줍니다.,Non-Sarcasm,이 문장은 유행어가 소통의 효율성을 높이는 긍정적인 측면을 강조하고 있어 비풍자적입니다.
어떤 나라가 과거에 침략한 국가들에 대한 역사 교육이나 배려를 충분히 하지 않는 상황.,"아, 그 나라의 역사책은 아마 '우리가 최고였던 시절'이라는 제목으로 시작하겠네.",Sarcasm,역사 교육의 부족을 비꼬며 그 나라가 자신의 우월성을 강조하는 내용을 담고 있을 것이라는 반어적인 표현이기 때문입니다.
귀여운 글을 볼 때마다 기분이 좋아지거나 마음이 설레는 상황,아마도 귀여운 글이 마음을 풍선처럼 부풀게 하는 마법이 있나 봐.,Sarcasm,귀여운 글이 실제로 마음을 부풀게 하는 마법이 없다는 것을 암시하며 과장된 표현을 사용하고 있기 때문입니다.
언론이 특정 정치인의 정책 발표에 대해 긍정적으로 보도하는 상황,"정말이지, 그분들이 발표만 하면 경제가 하늘로 솟구칠 것 같네요. 기레기들이야말로 진정한 예언자들인가 봐요!",Sarcasm,"정치인의 발표가 실제로 경제에 긍정적인 영향을 미치지 않을 것이라는 의도를 담고 있으며, 언론의 보도를 비꼬는 표현이기 때문에 sarcasm이다."
국정원의 사건이 언론에 의해 크게 보도된 상황,"국정원 사건이야말로 정말로 중요하지 않은 사건이죠, 언론이 이렇게 열심히 보도할 필요가 있을까요?",Sarcasm,"국정원 사건이 큰 이슈임에도 불구하고 '중요하지 않다'고 말하며 언론의 보도를 비꼬고 있어, 반어적인 표현이 사용되었다."
조용기 씨가 한국에서 목사로 활동하는 상황,조용기 씨는 많은 사람들에게 영적인 지도와 희망을 주고 있습니다.,Non-Sarcasm,이 문장은 조용기 씨의 긍정적인 역할을 진지하게 평가하고 있어 비풍자적입니다.
주식 투자자가 경제에 대해 불평하는 상황,"맞아, 경제가 안 좋으면 주식은 언제나 하늘을 날지!",Sarcasm,"주식이 경제가 안 좋을 때 상승하는 것은 불가능하므로, 이 말은 실제로는 반대의 의미를 지닌 비꼬는 표현이다."
알바생들이 고객 리뷰에 과도하게 긍정적인 평가를 남기는 상황,"아, 진짜 알바생들이 고객 서비스의 신이 되어가는 중인가 보네. 평점이 하늘을 뚫겠어!",Sarcasm,고객 서비스에 대한 과도한 칭찬을 반어적으로 표현하여 실제로는 그들이 그렇게 뛰어나지 않다는 것을 암시하고 있다.
누군가가 다른 사람을 겁주거나 협박하는 상황,그는 그에게 더 이상 협박하지 말라고 단호하게 말했다.,Non-Sarcasm,"이 문장은 협박에 대한 진지한 반응을 표현하고 있으며, 상황을 심각하게 받아들이고 있음을 나타냅니다."
결혼 후 시댁 방문을 줄이려는 상황,우리도 서로의 공간이 필요하니까 시댁 방문 횟수를 조정해보는 것이 좋을 것 같아요.,Non-Sarcasm,이 문장은 서로의 개인적인 공간을 존중하자는 진지한 제안이기 때문에 비풍자적입니다.
언론의 편향성과 보수적 기득권에 대한 비판이 제기된 상황,"와, 이제야 알았네요. 언론이 중립적이라고 믿었던 제가 순진했군요!",Sarcasm,"반응은 언론의 중립성을 믿었던 자신의 순진함을 비꼬는 방식으로, 실제로는 언론이 중립적이지 않다는 것을 이미 알고 있다는 의미를 담고 있다."
제품의 성능은 개선되었지만 가격이 올라 소비자가 불만족스러운 상황,제품의 성능이 향상된 만큼 가격이 적절하게 조정되었으면 좋겠습니다.,Non-Sarcasm,이 문장은 소비자의 기대와 제품의 가치에 대한 진지한 의견을 표현하고 있어 비풍자적입니다.
게임에서 라떼 캐릭터가 너프되어 플레이어가 실망하고 있다.,라떼 캐릭터의 너프는 많은 플레이어들에게 실망감을 주고 있습니다.,Non-Sarcasm,"이 문장은 플레이어들의 감정을 사실적으로 전달하고 있으며, 비꼬거나 조롱하는 요소가 없습니다."
영화 리뷰를 하면서 배우들의 연기와 영화의 분위기를 평가하는 상황,"이 영화에서 배우들의 연기는 매우 인상적이었고, 전체적인 분위기도 몰입감을 주었습니다.",Non-Sarcasm,영화의 긍정적인 요소를 진지하게 평가하고 있어 비풍자적입니다.
결혼 생활의 초기 갈등과 조정의 과정,"결혼은 사랑의 결실이 아니라, 라면 국물 양으로 시작되는 평생의 협상입니다. 다음엔 라면 회사에서 중재자를 보내야 할지도 모르겠네요!",Sarcasm,"결혼을 사랑의 결실이 아닌 라면 국물 양으로 비유하며, 결혼 생활의 복잡함을 과장되게 표현하여 실제로는 결혼의 진지함을 조롱하는 방식으로 유머를 사용하고 있기 때문입니다."
어린 시절에 감명 깊게 본 영화를 다시 보고 싶어하는 상황,그 영화를 다시 보면서 그때의 감정을 다시 느껴보고 싶어요.,Non-Sarcasm,영화를 다시 보고 싶다는 진솔한 마음을 표현하고 있어 비풍자적입니다.
아기가 좋아하는 장난감을 샀지만 내구성이 약해 실망스러운 상황,쥬쥬언니가 설거지를 도와주려고 사라지는 거라면 참 효율적인 장난감이네요!,Sarcasm,"실제로는 장난감의 내구성이 약해 실망스럽다는 점을 비꼬아, 장난감이 효율적이라는 말로 반어적인 의미를 전달하고 있다."
한 명밖에 없는 상황에 대해 아쉬움을 표현하고 있다.,"와우, 한 명이라도 있으니 정말 인산인해네요!",Sarcasm,실제로는 한 명만 있는 상황을 비꼬아 '인산인해'라고 표현하여 상황의 빈약함을 강조하고 있다.
독재를 옹호하는 사람이 한국이 독재국가가 아니라 다행이라고 말하는 상황,한국은 민주주의를 통해 시민의 목소리를 존중받는 사회입니다.,Non-Sarcasm,이 문장은 한국의 민주주의를 긍정적으로 평가하며 독재를 반대하는 입장을 명확히 하고 있기 때문에 비풍자적입니다.
"일부 사람들은 특정 성별이나 집단에 대한 편견을 가지고 있으며, 이를 정치적 상황과 연결지어 불만을 표현하고 있다.","맞아요, 대통령이 되면 모든 문제가 다 해결될 줄 알았죠. 일베가 무슨 문제겠어요, 그저 인터넷의 작은 오아시스일 뿐이죠.",Sarcasm,"대통령이 모든 문제를 해결할 것이라는 주장을 비꼬며, 일베와 같은 문제를 경시하는 발언을 통해 반어적으로 비판하고 있다."
정부나 정치인들이 국민들로부터 많은 비판을 받고 있는 상황,"국민들의 사랑을 너무 많이 받아서 서로 위로가 필요할 정도라니, 참으로 행복한 정치인들이네요!",Sarcasm,정치인들이 비판받고 있는 상황에서 '사랑을 많이 받는다'는 표현은 현실과 반대되는 상황을 강조하여 풍자하는 비꼬는 방식이다.
고객이 물건을 주문했으나 배송지 변경 문제로 인해 축산업체와 통화하면서 불쾌감을 느낀 상황,고객님께서 불편을 겪으신 점에 대해 진심으로 사과드립니다. 문제를 해결하기 위해 최선을 다하겠습니다.,Non-Sarcasm,이 문장은 고객의 불만을 진지하게 받아들이고 해결 의지를 표현하고 있어 비풍자적입니다.
고객이 물건을 주문했으나 배송지 변경 문제로 인해 축산업체와 통화하면서 불쾌감을 느낀 상황,"아, 요즘은 고객 서비스가 '우리 장사가 너무 잘 돼서 굳이 신경 쓸 필요가 없어요'라는 새로운 경지에 오른 것 같군요. 이런 마인드로도 사업이 잘 된다니, 정말 축복받은 시대입니다!",Sarcasm,"고객 서비스의 무관심을 비꼬아 표현하며, 실제로는 그 태도가 긍정적이지 않음을 강조하고 있기 때문에 sarcasm이다."
"운동 부족으로 인해 자다가 쥐가 나서 깼지만, 주말이 가까워져서 기분이 나아졌다.",운동은 못 해도 주말을 맞이하는 데에는 아무런 지장이 없지!,Sarcasm,"주말을 맞이하는 것과 운동 부족의 문제를 결부시켜, 주말이 기분을 좋게 해준다는 말이 실제로는 운동 부족의 부정적인 영향을 무시하는 듯한 반어적인 표현이기 때문입니다."
영화나 공연의 처음 부분은 지루했으나 시간이 지나면서 재미있어졌다.,"처음에는 지루했지만, 이야기가 진행될수록 점점 흥미로워졌다.",Non-Sarcasm,"이 문장은 영화나 공연의 진전을 긍정적으로 평가하며, 실제로 흥미가 증가했음을 진솔하게 전달하고 있기 때문에 비풍자적입니다."
사람들이 기대를 낮추어 실망에 대비하는 상황,"기대가 낮으면 실망이 덜할 테니, 이제는 모든 걸 기대하지 말아야겠네요. 어쩌면 매일매일이 즐거운 깜짝 선물일지도 모르죠!",Sarcasm,"일상에서 기대를 낮추는 것이 긍정적인 결과를 가져오지 않음을 암시하며, '즐거운 깜짝 선물'이라는 표현은 실제로는 실망스러운 상황을 비꼬는 의미로 사용되었기 때문에."
주식이나 암호화폐 등 투자 자산의 가격이 하락하여 손실을 보고 있는 상황,현재 시장 상황이 좋지 않아 많은 투자자들이 어려움을 겪고 있습니다.,Non-Sarcasm,"이 문장은 현실적인 상황을 진지하게 설명하고 있으며, 투자자들의 어려움을 공감하는 내용이기 때문에 비풍자적입니다."
피곤해서 벽에 기대어 쉬고 있는 상황,잠시 쉬면서 에너지를 회복하는 것이 중요해.,Non-Sarcasm,이 문장은 피곤함을 인정하고 회복의 필요성을 강조하고 있어 비풍자적입니다.
오피스텔의 방음이 좋지 않아 소음이 심한 상황,방음이 좋지 않아서 소음이 정말 신경 쓰이네요.,Non-Sarcasm,소음 문제에 대한 진솔한 불만을 표현하고 있어 비풍자적입니다.
침착맨의 콘텐츠를 너무 좋아해서 없으면 견디기 힘든 상황,침착맨의 콘텐츠는 제 일상에 큰 즐거움을 주어서 항상 보고 싶어요.,Non-Sarcasm,"이 문장은 침착맨의 콘텐츠에 대한 진정한 애정을 표현하고 있으며, 비꼬는 의미가 전혀 없습니다."
화자가 예상치 못한 사건이나 문제에 대해 놀라움을 표현하며 상대방의 상황 해결 여부를 묻고 있다.,"그럼요, 문제 해결은 마법처럼 저절로 되더라고요. 아무 노력도 필요 없었어요!",Sarcasm,"반응에서 '마법처럼 저절로'라는 표현은 문제 해결이 쉬운 일이 아님을 비꼬는 방식으로, 실제로는 노력과 시간이 필요하다는 것을 암시하고 있다."
비디오가게에서 영화나 비디오를 빌려보는 데이트를 즐기는 사람에 대한 이야기.,그들은 함께 좋아하는 영화를 고르며 즐거운 시간을 보냈다.,Non-Sarcasm,이 문장은 데이트의 즐거움과 영화 선택의 즐거움을 진지하게 표현하고 있어 비풍자적이다.
스트레스가 건강에 악영향을 미치는 상황,"네, 스트레스 덕분에 병원비로 경제가 활성화되고 있죠!",Sarcasm,"이 반응은 스트레스가 긍정적인 영향을 미친다는 비꼬는 표현으로, 실제로는 스트레스가 건강에 해롭다는 사실을 반영하고 있습니다."
"친구의 남자친구의 어머니가 매우 불쾌하거나 이해할 수 없는 행동을 했고, 이에 대해 친구에게 불만을 토로하는 상황","와, 너 남자친구 어머니 덕분에 내가 인류애를 새롭게 다 배우고 있어. 정말 고마워!",Sarcasm,"이 반응은 불쾌한 상황에 대한 반응으로, 실제로는 고마움을 표현하는 것이 아니라 비꼬는 방식으로 불만을 전달하고 있다."
한국의 법무부장관인 박상기가 전세계 코인 시장에 큰 영향을 미쳤다는 주장.,박상장관의 정책이 코인 시장에 긍정적인 변화를 가져올 수 있다는 점은 주목할 만합니다.,Non-Sarcasm,이 문장은 박상관의 정책이 실제로 긍정적인 영향을 미칠 수 있다는 가능성을 진지하게 언급하고 있어 비풍자적입니다.
