context,response,label,explanation
강원도에 중국 전통문화를 홍보하는 차이나타운을 건설하는 것에 대한 불만.,한국에서 중국 전통문화를 홍보하는 건 정말 신선하네요. 아마도 강원도는 인천에 질투가 났나 봐요!,Sarcasm,"이 반응은 중국 전통문화 홍보가 한국에서 비현실적이고 부적절하다는 비판을 우회적으로 표현하며, '신선하다'는 말이 실제로는 비꼬는 의미로 사용되고 있기 때문에 sarcasm이다."
누군가가 아프다고 핑계를 대며 어떤 일을 하지 않은 상황,그 사람이 아픈 것은 안타까운 일입니다.,Non-Sarcasm,이 문장은 그 사람의 아픔에 대한 진정한 동정심을 표현하고 있어 비풍자적입니다.
"누군가가 재미없고 감동 없는 글을 올렸고, 다른 사람이 그 글을 따라 하며 비꼬는 상황","와, 그 글은 정말로 감동적이었어요. 눈물 한 방울 안 흘리기가 힘들더라고요!",Sarcasm,실제로는 감동이 없었던 글을 과장되게 칭찬함으로써 비꼬는 의미가 담겨 있다.
무서운 상황,"오, 그래도 무서운 건 건강에 좋대요. 심장이 운동하니까!",Sarcasm,무서운 상황에서 건강에 좋다는 말은 실제로는 무서움을 부정적으로 평가하며 비꼬는 표현이기 때문에 sarcasm이다.
정치적 스캔들이나 논란이 발생한 상황,"네, 정치에서 스캔들 하나 없이 깨끗한 정당이 존재한다면 정말 놀라운 일이겠죠.",Sarcasm,"정당의 스캔들이 일반적이라는 사실을 비꼬아 표현하여, 깨끗한 정당이 존재하는 것이 불가능하다는 것을 암시하고 있습니다."
영화 리뷰를 하면서 배우들의 연기와 영화의 분위기를 평가하는 상황,"이 리뷰를 보니, 이제 영화 제작자들이 배우들에게 연기 수업을 다시 시켜야겠네요. 기대 이상이라는 말은 이제 칭찬인가 봅니다!",Sarcasm,반응에서 '기대 이상'이라는 표현이 실제로는 부정적인 의미로 사용되어 배우들의 연기가 형편없음을 비꼬고 있기 때문에 sarcasm이다.
"많은 사람들이 찾고 있던 중요한 물건이나 정보가 오랜 시간 동안 발견되지 않다가, 우연히 환경미화원에 의해 발견된 상황",역시 중요한 발견은 항상 전문가가 아닌 곳에서 나오는 법이죠. 다음엔 환경미화원분들께 탐정 자격증이라도 드려야겠어요.,Sarcasm,"전문가가 아닌 환경미화원이 발견한 사실을 비꼬아, 그들이 탐정 자격증을 받을 만큼의 능력이 있다는 말은 실제로는 불가능하다는 점에서 비꼬는 의미가 담겨 있다."
광수가 매우 중요하거나 재미있는 인물로 여겨지는 상황,광수가 없으면 아침에 해도 안 뜨겠네.,Sarcasm,"광수가 없으면 아침이 밝지 않다는 말은 그가 실제로 그렇게 중요한 존재가 아니라는 것을 과장하여 표현한 것으로, 아이러니와 비꼼이 담겨 있다."
코로나로 인해 집에 있는 시간이 많아져 체중이 증가했다.,이제 집에만 있으면 자동으로 살이 찌는 마법이라도 걸린 건가 봐.,Sarcasm,"상황을 과장하여 '마법'이라는 비유를 사용하며, 실제로는 체중 증가가 자연스러운 결과임을 비꼬고 있다."
생방송을 놓쳐서 아쉬워하는 상황,생방송을 놓쳤으니 이제 녹화본으로 두 배로 즐길 수 있겠네요!,Sarcasm,녹화본으로 보는 것이 생방송을 놓친 아쉬움을 덜어줄 수 없다는 사실을 비꼬는 표현이기 때문입니다.
급식의 질이 좋지 않아 학생들이 불만을 가지고 있는 상황,"와, 우리 학교 급식은 소도 거절할 만큼 고급지네!",Sarcasm,급식의 질이 나쁘다는 불만을 반어적으로 표현하여 실제로는 급식이 좋지 않음을 강조하고 있다.
소비자가 여러 개의 부정적인 리뷰가 같은 사람이나 그룹에 의해 작성되었다고 의심하는 상황,이 리뷰들은 같은 패턴을 보이고 있어 신뢰성이 떨어질 수 있습니다.,Non-Sarcasm,리뷰의 신뢰성을 분석하는 것이 소비자에게 중요한 정보이기 때문에 진지하게 접근하고 있습니다.
주인공이 테니스부에서 활동하다가 다른 사람에게 관심을 빼앗기는 만화,주인공은 테니스 연습에 더욱 집중하기로 결심했다.,Non-Sarcasm,이 문장은 주인공이 상황을 긍정적으로 받아들이고 발전하려는 의지를 표현하고 있어 비풍자적이다.
음식이 너무 많아서 먹기 싫은 상황,"와, 이렇게 많은 음식을 보니 다이어트는 오늘로 끝이네요!",Sarcasm,"실제로는 다이어트를 포기하고 싶지 않지만, 음식을 과도하게 보고 농담으로 다이어트를 끝냈다고 말하는 것이기 때문에 빈정대는 표현이다."
아이들이 연예인 이름을 잘 모를 것이라는 상황.,아이들은 아직 많은 정보를 알지 못하기 때문에 연예인 이름을 잘 모를 수 있습니다.,Non-Sarcasm,아이들의 나이와 경험을 고려한 진솔한 관찰이기 때문에 비풍자적입니다.
동네마트보다 비싸져서 대형마트를 이용하게 된 상황,대형마트에서 장을 보면 가격이 더 저렴해서 경제적으로 도움이 됩니다.,Non-Sarcasm,"이 문장은 대형마트의 가격이 더 저렴하다는 사실을 긍정적으로 받아들이고 있으며, 상황에 대한 실제적인 해결책을 제시하고 있습니다."
편의점 알바 중 손님이 집에 데려다주겠다고 따라오는 상황,"저는 괜찮습니다, 혼자서도 충분히 갈 수 있어요.",Non-Sarcasm,이 문장은 손님의 제안을 정중하게 거절하며 자신의 의사를 분명히 전달하고 있어 비풍자적입니다.
상대방이 생활비로 매달 200만 원을 사용하는 것에 대해 비판하는 상황.,"너무 많은 돈을 생활비로 쓰는 것 같아, 좀 더 절약할 방법을 찾아보는 게 좋을 것 같아.",Non-Sarcasm,"이 문장은 상대방의 소비를 비판하는 것이 아니라, 더 나은 재정 관리를 제안하는 진지한 조언을 담고 있습니다."
누군가 자신의 비밀을 잘 지킬 수 있다고 주장하고 있다.,나는 너의 비밀을 잘 지킬 수 있다고 믿어.,Non-Sarcasm,이 문장은 상대방의 주장에 진정으로 믿음을 표현하고 있어 비풍자적입니다.
게임에서 철화단 아저씨가 계속해서 도전하라고 격려하는 상황,철화단 아저씨의 격려 덕분에 더 열심히 도전할 수 있을 것 같아.,Non-Sarcasm,"이 문장은 철화단 아저씨의 긍정적인 영향을 진지하게 받아들이고, 그에 대한 감사의 마음을 표현하고 있기 때문에 비풍자적입니다."
무기 종류에 대한 잘못된 정보를 정정하는 상황,"아, 그렇군요. 이제 사슬과 막대기를 헷갈리지 않게 되었으니 전쟁 준비는 완벽하겠어요.",Sarcasm,전쟁 준비가 완벽하다는 말은 실제로는 무기 구분이 중요하지 않다는 비꼬는 표현이다.
강훈련사가 나보다 나이가 어린 상황,강훈련사가 젊지만 그의 전문성과 경험은 매우 인상적이다.,Non-Sarcasm,이 문장은 강훈련사의 능력을 긍정적으로 평가하고 있어 비풍자적입니다.
돈을 들여 반미 영화를 제작한 상황,이 영화는 반미적인 메시지를 통해 사회의 문제를 조명하고 있습니다.,Non-Sarcasm,"비판적인 주제를 진지하게 다루고 있으며, 영화의 의도를 긍정적으로 평가하는 문장입니다."
영화나 작품의 평론가 평점이 좋지만 실제로는 그렇지 않을 수 있다는 상황.,"이 영화는 평론가들로부터 높은 평가를 받았지만, 관객들의 반응은 그와는 다르게 차가웠습니다.",Non-Sarcasm,이 문장은 평론가와 관객의 반응이 다르다는 사실을 사실적으로 전달하고 있어 비풍자적입니다.
친구가 어떤 사실을 부정하면서 농담을 하는 상황,"그건 사실이 아니야, 하지만 그런 생각을 해본 적이 있어.",Non-Sarcasm,이 문장은 친구의 농담을 인정하면서도 자신의 생각을 진지하게 표현하고 있어 비풍자적이다.
미야자키 하야오의 새로운 애니메이션이 이전 작품들에 비해 실망스럽다는 상황,미야자키 하야오 감독이 드디어 인간미를 보여주셨군요. 이제 우리도 천재가 아닌 사람임을 알게 되었어요.,Sarcasm,"이 반응은 미야자키 하야오 감독의 실망스러운 작품을 비꼬아, 그가 인간적임을 강조함으로써 그의 천재성이 상실되었다는 것을 풍자하는 방식으로 표현하고 있다."
기저귀를 구매했는데 기존 사용하던 제품과 달라서 불만인 상황,"아, 드디어 바지까지 촉촉하게 해주는 혁신적인 기저귀를 만났군요! 정말 신기한 체험이네요!",Sarcasm,"기저귀의 불만을 비꼬아 표현하며, 실제로는 부정적인 경험임에도 불구하고 긍정적인 어조로 말하고 있어 아이러니함을 드러내기 때문입니다."
영화나 드라마에서 예상치 못한 반전이 여러 번 일어나는 상황,이제 반전 없는 작품이 더 반전일 듯?,Sarcasm,반전이 없는 작품이 오히려 예상치 못한 반전으로 여겨진다는 말은 실제로는 반전이 있는 작품이 지배적인 상황에서 그 반전 없는 작품이 더 특별하다는 아이러니를 담고 있다.
친구가 아이를 두고 멀리 떠나 있는 상황,친구가 아이를 위해 최선을 다하고 있다는 걸 알고 있어.,Non-Sarcasm,이 문장은 친구의 상황을 이해하고 지지하는 진심 어린 표현이기 때문에 비풍자적입니다.
정치적 스캔들이나 논란이 발생한 상황,이번 정치적 스캔들은 국민의 신뢰를 크게 저하시킬 수 있습니다.,Non-Sarcasm,이 문장은 정치적 스캔들이 미치는 부정적인 영향을 진지하게 언급하고 있어 비풍자적입니다.
사손이 고릴라와의 인연에 대해 슬퍼하는 상황,사손은 고릴라와의 소중한 추억을 잊지 않을 것입니다.,Non-Sarcasm,이 문장은 사손의 슬픔을 진지하게 받아들이고 고릴라와의 관계의 가치를 인정하는 긍정적인 표현입니다.
"아기 쇼파를 구입했는데, 사진이 어둡게 나왔고 크기가 작지만 색상이 예쁘고 안정감이 있어 만족하는 상황",작고 안정감 있는 쇼파 덕분에 이제 아기가 쇼파 위에서 세계 정복을 꿈꿀 수 있겠네요!,Sarcasm,아기가 세계 정복을 꿈꾼다는 표현은 실제로는 불가능한 상황을 과장하여 비꼬는 말이기 때문에 sarcasm입니다.
정당에서 지원하는 증인들이 신뢰할 수 없는 인물들인 상황,"아, 그 정당은 아마 '신뢰할 수 없는 인물 발굴 프로젝트'라도 진행 중인가 보죠?",Sarcasm,"정당이 신뢰할 수 없는 인물을 지원하는 상황을 조롱하며, 실제로는 그런 프로젝트가 존재하지 않음을 암시하고 있기 때문에."
영화 '더 울버린'을 보고 실망한 관객이 '엑스맨3'보다 더 나쁘다고 평가하며 시간을 낭비했다고 느끼고 있다.,"아, 이제 '엑스맨3'가 걸작으로 보이게 해주는 영화가 나왔군요. 감사합니다, 더 울버린!",Sarcasm,'더 울버린'의 실망스러운 평가를 반영하여 '엑스맨3'를 비꼬는 방식으로 표현함으로써 실제로는 긍정적인 감정을 담고 있지 않기 때문에 풍자적이다.
작은 기업에서 인사와 총무를 겸직하며 다양한 업무를 수행하는 상황,"작은 기업에서 인사와 총무를 겸직하는 건 마치 서커스에서 여러 공을 동시에 던지는 광대 같은 느낌이죠. 다만, 차이점은 광대는 웃고 있지만, 우리는 웃지 않는다는 것?",Sarcasm,"작은 기업에서의 고된 업무를 서커스의 광대에 비유하며, 실제로는 힘든 상황임에도 불구하고 웃지 못하는 현실을 강조하여 비꼬는 표현이다."
영화가 매우 재미없어서 끝까지 보기 어려운 상황,이 영화는 정말 기대에 미치지 못했어요.,Non-Sarcasm,"이 문장은 영화에 대한 솔직한 감정을 표현하고 있으며, 비판적인 의견을 진지하게 전달하고 있습니다."
백신 접종 후 부작용에 대한 우려로 인해 사람들이 접종을 꺼리는 상황,백신 접종의 중요성과 안전성에 대한 정보가 더 많이 제공되어야 합니다.,Non-Sarcasm,"이 문장은 백신의 안전성을 강조하며, 우려를 해소하기 위한 건설적인 제안을 하고 있기 때문에 비풍자적입니다."
피부 알레르기가 있는 상황,그러니까 알레르기랑 친해지려고 자주 빨아 쓰라는 거죠? 두드러기랑도 친구가 될 수 있겠네요!,Sarcasm,"알레르기를 자주 빨아 쓰라는 말은 비현실적이고 부조리한 제안으로, 실제로는 알레르기를 피해야 한다는 점에서 비꼬는 의미가 담겨 있다."
자신의 경험이 기사로 보도되었고 많은 친구들이 이를 기억하는 상황,"아, 기자님, 그 기사는 아마도 역사책에 실릴 만큼 중요했나 보군요. 서강대 연구소에서 설문조사한 결과는 전 국민의 기억 속에 영원히 남을 테니까요!",Sarcasm,반응에서 기사의 중요성을 과장하여 표현함으로써 실제로는 그 기사가 중요하지 않다는 것을 비꼬고 있다.
게임에서 철화단 아저씨가 계속해서 도전하라고 격려하는 상황,"아, 철화단 아저씨는 아마도 자기 커피가 식을까 봐 걱정할 필요가 없겠군요. 계속해서 싸우라고 하니까요.",Sarcasm,"철화단 아저씨의 격려가 진정한 관심에서 비롯된 것이 아니라, 그가 다른 일을 걱정하지 않을 정도로 여유롭다는 점을 비꼬는 표현이기 때문에 sarcasm이다."
"세월호 사고를 떠올리며, 비슷한 상황이나 대응 방식에 대한 불만이나 실망을 표현하는 상황","아, 그럼요. 안전 불감증은 우리나라의 자랑스러운 전통이죠.",Sarcasm,"안전 불감증을 긍정적으로 표현하며 비꼬는 방식으로, 실제로는 부정적인 상황을 비판하고 있다."
어떤 영화나 공연이 성인용 콘텐츠임에도 불구하고 부모들이 초등학생 자녀를 데리고 오는 상황.,부모들은 자녀에게 다양한 경험을 제공하고 싶어하는 것 같습니다.,Non-Sarcasm,"이 문장은 부모의 의도를 긍정적으로 해석하고 있으며, 비판적인 태도가 아닌 이해를 바탕으로 작성되었습니다."
주식이나 투자에서 손실이 큰 상황,"아, 이제야 -90% 손실을 보고 나니 '아, 그때 팔았어야 했구나'라는 깨달음을 얻는 게 참으로 신선하네요. 역시 경험은 최고의 스승이라더니!",Sarcasm,"반응에서 손실을 경험한 후에야 깨달음을 얻었다고 하면서, 그 깨달음이 신선하다는 표현은 실제로는 그 상황이 매우 불행하고 아이러니하다는 것을 강조하기 위해 사용된 비꼬는 말입니다."
영화나 드라마를 기대하고 봤는데 일상적인 내용만 보여주는 상황,이 작품 덕분에 저도 제 일상이 얼마나 특별한지 깨달았답니다. 내일부터는 제 삶도 영화로 만들어야겠어요!,Sarcasm,"일상적인 내용에 대한 실망을 반어적으로 표현하며, 실제로는 자신의 삶이 특별하지 않다는 것을 강조하고 있습니다."
윤석렬 시대에 검찰의 권력이 세상에서도 그대로 통할 것이라 착각하는 상황,"아, 그럼요. 검찰청에서 대장노릇 했으니 이제 세계 정복도 문제없겠어요!",Sarcasm,"검찰청에서의 권력 행사를 세계 정복과 연결짓는 것은 비현실적이고 우스꽝스러운 비유로, 실제로는 불가능하다는 점을 강조하기 위해 비꼬는 표현이다."
"곱창을 먹는 것이 건강에는 좋지 않지만, 그 맛 때문에 계속 찾게 되는 상황",곱창의 맛이 정말 매력적이라 자주 찾게 됩니다.,Non-Sarcasm,"곱창의 맛을 긍정적으로 평가하며, 그로 인해 자주 찾는다는 사실을 진지하게 표현하고 있기 때문입니다."
회식이 자주 열리지만 특정 사람들만 참여하는 상황,"정말 모두가 참여할 수 있는 회식이라니, 투명성과 공정성의 끝판왕이네요!",Sarcasm,"회식에 특정 사람들만 참여한다는 사실을 비꼬아, 실제로는 불투명하고 불공정한 상황임을 강조하고 있기 때문입니다."
"어두운 길을 혼자 다니는 것이 무서워 남자친구에게 매일 데리러 오라고 부탁하고 싶지만, 그것이 부담스러워 회사에 시간대 변경을 요청할지 고민하는 상황","그러게요, 남친이 매일 데리러 오면 그야말로 '왕자님 구하기' 프로젝트가 되겠네요. 회사에 시간대 변경 요청하면 '야근의 여왕'으로 등극할지도 모르고요!",Sarcasm,"남자친구에게 매일 데리러 오라고 부탁하는 상황을 과장되게 표현하며, 실제로는 부담스러운 요청이 유치하게 느껴진다는 것을 비꼬고 있기 때문입니다."
영화가 불편한 주제나 내용을 담고 있어 관객에게 불쾌감을 줄 수 있는 상황,이 영화는 사회의 복잡한 문제를 다루고 있어 관객에게 깊은 생각을 하게 만듭니다.,Non-Sarcasm,"이 문장은 영화의 주제를 긍정적으로 평가하며, 관객에게 생각할 기회를 제공한다고 설명하고 있어 비풍자적입니다."
아이의 어학교육을 위해 저렴하고 필수 기능만 있는 MP3 플레이어를 구매한 상황,이 MP3 플레이어는 아이의 언어 학습에 필요한 기능만 갖추고 있어서 매우 유용합니다.,Non-Sarcasm,이 문장은 MP3 플레이어의 기능이 실제로 아이의 교육에 도움이 된다는 긍정적인 평가를 담고 있기 때문에 비풍자적입니다.
주말 점심 시간에 영화관이 거의 비어 있는 상황,이 시간대에 영화관이 한산해서 편안하게 영화를 볼 수 있겠네요.,Non-Sarcasm,영화관이 비어 있는 상황을 긍정적으로 평가하며 실제로 편안함을 느낄 수 있다는 점을 표현하고 있기 때문입니다.
남양유업이 또다시 논란이 될 만한 행동을 한 상황,남양유업은 소비자 신뢰를 회복하기 위해 투명한 소통이 필요합니다.,Non-Sarcasm,"이 문장은 남양유업의 행동에 대한 진지한 의견을 제시하며, 문제 해결을 위한 건설적인 제안을 하고 있기 때문에 비풍자적입니다."
중학생이 만든 자작곡이 예상외로 훌륭하다고 칭찬하는 상황,너의 자작곡은 정말 멋져! 음악적 재능이 대단해.,Non-Sarcasm,"이 문장은 중학생의 노력을 진심으로 칭찬하고 있으며, 비꼬는 의도가 전혀 없기 때문에 비풍자적이다."
힘든 상황에서 자신의 감정을 인정하기 어려운 상황,이런 감정을 느끼는 것은 자연스러운 일이야.,Non-Sarcasm,이 문장은 힘든 감정을 인정하는 것이 정상이라는 진지한 메시지를 전달하고 있어 비풍자적이다.
남양유업이 또다시 논란이 될 만한 행동을 한 상황,"남양유업, 논란 제조기 상 수상할 날도 머지않았네!",Sarcasm,남양유업의 행동이 부정적이기 때문에 '논란 제조기 상'을 수상할 것이라는 표현은 실제로는 비꼬는 의미로 사용되었다.
"임요환은 매우 경쟁적이고 승부욕이 강한 사람으로 알려져 있으며, 그의 가족도 비슷한 성향을 가지고 있을 것이라는 추측이 담겨 있다.","아, 그러게요. 아침에 누가 더 빨리 밥 먹나로도 경쟁하겠어요.",Sarcasm,반응이 과장된 방식으로 가족의 경쟁심을 비꼬아 표현하여 실제로는 그들의 경쟁심이 일상적인 상황에서까지 미치지 않을 것이라는 의미를 전달하고 있다.
의사소통이 잘 되지 않는 상황,저분이랑 얘기하면 벽이랑 대화하는 기분이겠네.,Sarcasm,상대방과의 대화가 전혀 의미가 없다는 것을 비유적으로 표현하여 실제로는 대화가 잘 이루어지지 않는 상황을 풍자하고 있다.
누군가의 말투가 일본어를 번역한 것처럼 어색하게 들린다.,그 사람의 말투는 정말 독특하고 흥미롭다.,Non-Sarcasm,"이 문장은 그 사람의 말투를 긍정적으로 평가하며, 비꼬지 않고 진심으로 흥미를 느끼고 있음을 나타낸다."
군대에서 계급에 상관없이 개인적인 일은 스스로 해결해야 한다는 주장.,"그렇죠, 장군님들도 이제 커피를 직접 타 마시면서 군대의 민주화를 선도하고 계시네요. 다음엔 설거지 당번도 직접 하시겠어요?",Sarcasm,"장군들이 개인적인 일까지 직접 해야 한다는 주장을 비꼬며, 실제로는 그들이 그런 일을 하지 않을 것이라는 점을 강조하고 있습니다."
화자는 쓸데없는 일에 에너지를 낭비하는 대신 자신과 소중한 사람에게 집중하는 것이 더 낫다고 생각한다.,"맞아요, 쓸데없는 일에 에너지를 쏟는 건 마치 물 없는 수영장에서 수영하는 것만큼이나 생산적이죠^^",Sarcasm,"물 없는 수영장에서 수영하는 것은 불가능하고 비생산적이라는 점에서, 쓸데없는 일에 에너지를 쏟는 것을 비꼬는 표현이기 때문에 sarcasm이다."
상대방이 평소와 다르게 보이거나 문제가 있어 보이는 상황,"아니요, 그냥 세상을 구하느라 좀 바빴어요.",Sarcasm,상대방의 문제를 진지하게 받아들이지 않고 과장된 방식으로 대답하여 상황을 비꼬고 있다.
최대집이 의사보다는 정치 활동에 더 집중하고 있다는 상황,최대집이 의사 가운을 입고 국회로 출근할 날도 머지않았네요.,Sarcasm,"이 표현은 최대집이 의사로서의 역할보다 정치 활동에 집중하고 있다는 사실을 비꼬아, 그가 의사 가운을 입고 국회에 출근하는 것이 어울리지 않음을 강조하고 있습니다."
제로코크와 제로펩시의 카페인 함량을 비교하는 상황,"맞아요, 제로펩시 마시면 밤새도록 잠 안 와서 생산성 폭발하겠네요!",Sarcasm,"제로펩시의 카페인 함량이 낮다는 점을 비꼬아, 실제로는 생산성이 떨어질 것이라는 의미로 반응하고 있기 때문입니다."
아이돌 가수가 대형기획사의 지원을 받아 여러 방송에 출연하는 상황,이 아이돌 가수는 대형기획사의 지원 덕분에 다양한 방송에서 활발하게 활동하고 있습니다.,Non-Sarcasm,이 문장은 아이돌 가수의 활동과 기획사의 지원을 긍정적으로 설명하고 있어 비풍자적입니다.
울타리 밖에서 물을 담으려다 다 흘려서 혼나는 상황,다음에는 더 조심해서 물을 담아야겠어요.,Non-Sarcasm,이 문장은 상황을 반성하고 개선하려는 의도를 나타내므로 비풍자적입니다.
반려동물들이 함께 지내는 상황,우리 집의 반려동물들은 서로 잘 어울려서 항상 즐거운 시간을 보냅니다.,Non-Sarcasm,이 문장은 반려동물들이 화목하게 지내는 긍정적인 상황을 진지하게 묘사하고 있기 때문에 비풍자적입니다.
은지 언니가 유명 브랜드 SUNDAYMONDAY의 의상을 입어보고 그 독특한 스타일에 감탄하며 친구들과 가게 안에서 떠들고 있는 상황,정말 대단해! 이제 SUNDAYMONDAY의 의상 덕분에 패션계의 거장이 된 기분이야. 다음엔 파리 패션위크에 초대받겠어!,Sarcasm,"패션계의 거장이 된 기분이라는 표현은 실제로는 과장된 칭찬으로, 의상의 진정한 가치를 비꼬는 의미가 담겨 있다."
아파트를 팔지 않고 세를 주었기 때문에 다행이라고 생각하는 상황,"아파트를 세를 주어서 정말 다행이네요. 이제 플러퍼를 고용할 필요가 없으니, 그 돈으로 그냥 커피나 마시러 가죠!",Sarcasm,아파트를 세를 주는 것이 실제로는 큰 비용 절감이 아닌데도 이를 긍정적으로 과장하여 표현함으로써 아이러니한 상황을 강조하고 있다.
서로에게 익숙해져서 의존적인 관계에 있는 상황,"맞아요, 우리는 서로에게 길들여진 게 아니라, 마치 오래된 소파와 그 위의 쿠션처럼 그냥 눌려져 있는 것뿐이죠.",Sarcasm,"반응에서 '길들여진 게 아니라'는 표현은 실제로는 서로에게 의존적인 관계를 비꼬아, 단순히 눌려져 있다는 비유를 통해 관계의 부정적인 측면을 강조하고 있기 때문입니다."
자신의 몫이나 이익이 모두 다른 사람에게 넘어간 상황,"아, 역시 저는 일만 하고 결과는 다른 사람이 가져가는 게 제 인생 모토였죠!",Sarcasm,"반응에서 '인생 모토'라는 표현은 실제로는 불만을 나타내며, 자신의 노력에 대한 보상을 받지 못한 상황을 비꼬는 의미로 사용되었기 때문에 비꼬는 어조가 드러난다."
주식이나 투자에서 큰 손실을 본 상황,앱을 삭제했으니 이제 손실도 삭제되겠네요!,Sarcasm,앱 삭제가 실제 손실을 없애는 것과는 전혀 관련이 없다는 점에서 비꼬는 표현이다.
