context,response,label,explanation
"정치적 또는 사회적 상황에서 누군가가 개선을 약속하지만, 실제로는 변화가 없거나 부정적인 결과가 계속되는 상황",우리는 변화를 위해 더 많은 노력이 필요하다고 생각합니다.,Non-Sarcasm,이 문장은 현실적인 문제 인식을 바탕으로 개선을 위한 진지한 노력을 촉구하고 있어 비풍자적입니다.
친구가 어떤 사실을 부정하면서 농담을 하는 상황,"맞아요, 지구는 평평하고, 해는 매일 우리 주위를 돌죠!",Sarcasm,이 반응은 상식에 반하는 내용을 과장하여 표현함으로써 친구의 부정적인 주장을 비꼬고 있다.
음악을 듣고 있는데 갑자기 예상치 못한 소리가 나서 웃긴 상황,"아, 이 곡은 숨겨진 코미디 트랙이었나 보네. 작곡가의 유머 감각이 뛰어나군.",Sarcasm,예상치 못한 소리로 인해 웃긴 상황을 진지하게 받아들이지 않고 오히려 작곡가의 유머 감각을 과장하여 비꼬는 방식으로 표현하고 있기 때문입니다.
모자이크가 심해서 중요한 부분이 제대로 보이지 않는 상황,이제 모자이크 덕분에 상상력이 풍부해지는 시대가 왔네요!,Sarcasm,모자이크로 인해 중요한 부분이 가려진 상황에서 긍정적인 표현을 사용하여 실제로는 불만을 드러내고 있기 때문입니다.
문재인과 안철수 후보가 정치적 단일화를 논의하는 상황,새누리당은 아마도 단일화가 너무 잘 돼서 두 후보가 한 팀이 되는 걸 기대하고 있을지도 모르겠네요. 그래서 짜증이 나는 거겠죠?,Sarcasm,"이 반응은 새누리당이 두 후보의 단일화에 대해 긍정적으로 기대한다는 점을 과장하여 표현하며, 실제로는 그런 기대가 없음을 암시하고 있어 비꼬는 의미가 담겨 있다."
웅장이라는 인형을 소유한 사람들끼리 반갑게 인사를 나누는 상황,웅장 인형이 우울증 치료제였군요! 이제 병원은 필요 없겠네요.,Sarcasm,"인형이 실제로 우울증 치료제가 아니라는 점에서, 인형을 과장되게 치료제로 언급하며 비꼬는 표현이다."
희망 없는 사랑에 빠져 슬픔에 잠긴 상황,이 사랑이 끝나지 않기를 바라는 마음이 너무 아프다.,Non-Sarcasm,"이 문장은 진정한 감정을 표현하며, 슬픔과 애절함을 솔직하게 드러내고 있기 때문에 비풍자적이다."
언론이 특정 정치인의 정책 발표에 대해 긍정적으로 보도하는 상황,이번 정책 발표는 많은 시민들에게 긍정적인 영향을 미칠 것으로 기대됩니다.,Non-Sarcasm,"이 문장은 언론의 보도 내용을 그대로 반영하며, 진정한 기대감을 표현하고 있기 때문에 비풍자적입니다."
오피스텔의 방음이 좋지 않아 소음이 심한 상황,오피스텔에서 살면 매일 무료로 이웃의 생활 소음을 감상할 수 있죠!,Sarcasm,이웃의 소음을 '무료 감상'이라고 표현함으로써 실제로는 불만을 표현하고 있는 것이기 때문에 비꼬는 말투가 드러납니다.
테오에게 그림을 그리느라 신세를 졌다는 부담감과 무력감을 느끼는 상황,"내가 테오에게 그림을 부탁한 것은 정말 좋은 선택이었고, 그의 도움 덕분에 더 나은 결과물을 얻을 수 있었다.",Non-Sarcasm,이 문장은 테오의 도움을 진정으로 감사하게 여기며 긍정적인 결과를 강조하고 있어 비풍자적이다.
타진요 Mk.2가 기존의 타진요보다 더 나은 성과를 목표로 하고 있는 상황,타진요 Mk.2가 타진요를 뛰어넘으려는 건 마치 원조 라면 가게가 분점을 내면서 '이번엔 진짜 라면'이라고 광고하는 것 같네요.,Sarcasm,기존 제품보다 우수하다는 주장에 대해 원조의 신뢰성을 비꼬며 실질적인 개선이 없음을 암시하고 있기 때문입니다.
중복 할인 정책이 변경되어 더 이상 혜택을 받을 수 없는 상황,이제 중복 할인 혜택을 받을 수 없어서 아쉽습니다.,Non-Sarcasm,이 문장은 실제로 아쉬움을 표현하고 있어 비풍자적입니다.
비가 올 것 같은데 우산을 사무실에 두고 나와서 곤란한 상황,"날씨가 내 우산 없는 걸 눈치챘나 보네, 정말 친절하게도 비를 내려주네!",Sarcasm,상대방의 비가 오는 상황을 '친절하게' 표현함으로써 실제로는 불만과 아이러니를 드러내고 있기 때문입니다.
신종플루가 퍼지면서 과도한 공포와 잘못된 대응으로 인해 극단적인 행동을 하는 상황,"네, 확실히 예방 차원에서 모든 걸 없애버리면 문제도 사라지겠죠. 그야말로 인류애 넘치는 해결책이네요.",Sarcasm,"극단적인 해결책을 비꼬며, 실제로는 비인간적이고 비효율적인 접근임을 강조하고 있기 때문에."
정부의 정책이 부동산 시장과 중소기업에 부정적인 영향을 미치고 있다는 비판적인 상황.,다음엔 아마 국민들의 주말을 없애서 여가 생활까지 철저히 관리해 주실지도 모르겠네요!,Sarcasm,"정부의 정책이 부정적이라는 비판을 비꼬아, 국민의 자유까지 통제할 것이라는 과장된 상상을 통해 비판의 강도를 높이고 있기 때문입니다."
중고 PC를 구매했는데 배송은 빨랐지만 초기 부팅 시 재부팅 문제가 발생하는 상황,다음엔 컴퓨터가 스스로 문제를 해결하는 기능도 추가해주시면 감사하겠습니다!,Sarcasm,"컴퓨터가 스스로 문제를 해결하는 기능은 현실적으로 불가능하므로, 문제에 대한 불만을 비꼬는 방식으로 표현한 것이다."
경영경제학 이론을 배운 사람이 실제 경험 없이 이론만으로 다른 사람에게 조언하는 상황,"아, 역시 책만 읽으면 모든 걸 다 아는 줄 아는 경영 천재들이군요. 실전 경험은 책장에 꽂아두면 되겠네요!",Sarcasm,"실전 경험 없이 이론만으로 조언하는 사람들을 비꼬아 '경영 천재'라고 칭하며, 실제 경험의 중요성을 강조하는 반어적인 표현이다."
작품이나 콘텐츠가 현실성과 개연성이 부족하여 시간 때우기 용도로만 적합한 상황,이 작품은 상을 받을 정도로 현실적이지 않아서 오히려 신선하네요!,Sarcasm,현실성이 부족하다는 비판을 상을 받을 정도로 긍정적으로 표현하여 반어적인 의미를 전달하고 있다.
돈을 빌려간 사람이 갚지 않고 도망간 상황,"아, 그 사람이 사고로 죽었다니, 아마도 '갚을 돈' 무게에 깔려서였겠죠?",Sarcasm,"반응은 상대방의 죽음을 비꼬며, 돈을 갚지 않은 것과 관련하여 무겁게 느껴지는 '갚을 돈'을 언급함으로써 진지한 상황을 조롱하고 있다."
비가 올 것이라는 소식을 듣고 놀란 상황,"와, 정말 놀라운 소식이네요! 비가 오는 건 마치 하늘에서 물이 떨어지는 것처럼 자연스러운 일이죠!",Sarcasm,"비가 오는 것은 일반적으로 예상되는 일인데, 이를 놀라운 소식으로 표현함으로써 반어적인 의미를 전달하고 있다."
사람들은 변하지만 사랑은 변하지 않는다는 상황,"그래서 사랑은 변하지 않아서 여전히 같은 자리에 있는데, 사람들은 매번 그 자리를 못 찾는 거군요!",Sarcasm,사랑이 변하지 않는다는 점을 강조하면서 사람들의 무능력을 비꼬는 방식으로 표현하여 반어적인 의미를 전달하고 있습니다.
매우 웃기거나 어이없는 상황,이 상황은 정말 예상치 못한 일이라서 웃음을 자아낸다.,Non-Sarcasm,상황의 웃음을 진지하게 받아들이고 긍정적으로 표현하고 있기 때문에 비풍자적이다.
"정치인들이 상대방의 작은 잘못은 크게 비난하면서, 정작 자신들의 심각한 문제는 묵인하는 상황",정치인들은 자신의 문제를 숨기기보다 솔직하게 인정하고 해결책을 찾아야 합니다.,Non-Sarcasm,이 문장은 정치인들이 자신들의 문제를 인정하고 해결해야 한다는 진지한 주장을 담고 있어 비풍자적입니다.
친구가 립밤을 떨어뜨리고 화를 내는 상황,"괜찮아, 립밤은 다시 살 수 있어.",Non-Sarcasm,친구의 감정을 이해하고 위로하며 긍정적인 시각을 제시하고 있기 때문에 비풍자적이다.
누군가의 행동이나 발언이 어리석거나 부적절하여 안타까움을 느끼는 상황,"그 사람이 그렇게 행동한 이유가 궁금하지만, 정말 안타깝네요.",Non-Sarcasm,이 문장은 상대방의 행동에 대한 진정한 안타까움을 표현하고 있어 비풍자적입니다.
운전자가 차량 위에 쌓인 눈을 제거하지 않고 운전하는 상황,운전자는 안전을 위해 차량 위의 눈을 반드시 제거해야 합니다.,Non-Sarcasm,"이 문장은 운전자의 안전을 강조하며, 실제로 필요한 조치를 권장하는 진지한 조언이기 때문에 비풍자적입니다."
아이돌 멤버의 얼굴을 자주 봤지만 이름을 잊은 상황,"아, 그 얼굴은 매일 보는데 이름은 기억 안 나는 그 흔한 경우죠. 참, 아재개그는 언제나 기억에 남는데 말이죠!",Sarcasm,"일상적인 상황을 언급하며 아재개그를 언급함으로써, 사실은 그 상황이 전혀 흔하지 않음을 강조하고 있다."
영화에서 역사적 사실을 왜곡하여 13대 대통령이 등장하는 상황,"이 영화는 역사적 사실을 바탕으로 하지만, 창작적인 요소를 추가하여 이야기를 전개하고 있습니다.",Non-Sarcasm,"이 문장은 영화의 창작적 접근을 긍정적으로 설명하며, 비꼬지 않고 사실을 전달하고 있습니다."
5인 이상 모임이 금지된 상황,그럼 청와대에선 국회도 열겠네요!,Sarcasm,"국회는 많은 인원이 모이는 자리인데, 금지된 상황을 비꼬아 청와대에서 그런 모임을 열 수 없다는 점을 강조하고 있다."
포인트를 더 얻기 위해 여러 장을 구매한 상황,더 많은 포인트를 얻기 위해 여러 장을 구매하는 것은 좋은 전략입니다.,Non-Sarcasm,"이 문장은 구매의 이점을 긍정적으로 평가하고 있으며, 비꼬는 의미가 전혀 없습니다."
비가 올 것이라는 소식을 듣고 놀란 상황,우산을 챙기는 것이 좋겠어요.,Non-Sarcasm,비가 올 것이라는 정보에 따라 실제로 필요한 행동을 제안하는 진지한 문장입니다.
동네 족발집 사장님과 특별한 경험을 공유한 상황,사장님과의 대화에서 정말 많은 것을 배웠어요.,Non-Sarcasm,이 문장은 사장님과의 진정한 경험을 통해 긍정적인 배움을 얻었다는 사실을 전달하고 있어 비풍자적입니다.
"시어머니가 귀신을 볼 정도로 예리하고 무서운데, 그 남자는 그보다 더 이상하고 무서운 상황",그 남자는 정말로 기이한 행동을 보여서 모두가 두려워하고 있다.,Non-Sarcasm,이 문장은 남자의 행동이 실제로 두려움을 유발한다는 사실을 진지하게 전달하고 있어 비풍자적이다.
"삶과 죽음, 그리고 존재의 의미에 대한 철학적 고뇌를 표현한 상황",이런 깊은 철학적 고민은 결국 커피 한 잔으로 해결될 수 있다는 사실을 모르는 사람은 없겠죠.,Sarcasm,심각한 철학적 문제를 단순한 커피 한 잔으로 해결할 수 있다는 말은 실제로는 그 문제의 복잡성을 비웃는 조롱의 표현이다.
중고 PC를 구매했는데 배송은 빨랐지만 초기 부팅 시 재부팅 문제가 발생하는 상황,중고 PC의 초기 부팅 시 재부팅 문제가 발생해서 해결 방법을 찾아보는 중입니다.,Non-Sarcasm,"문장이 문제를 객관적으로 설명하고 있으며, 비판이나 풍자가 아닌 실제 상황에 대한 진술이기 때문입니다."
웃음을 참을 수 없는 상황,이 상황은 정말 웃기네요.,Non-Sarcasm,상황이 웃음을 유발하는 진정한 감정을 표현하고 있기 때문에 비풍자적입니다.
무서운 소리를 듣고 놀란 상황,이 소리가 정말 무섭고 긴장돼.,Non-Sarcasm,이 문장은 실제로 무서운 소리에 대한 진실한 감정을 표현하고 있어 비풍자적입니다.
오랜만에 트위터 계정을 운영하는 홍보실 온라인팀이 회식을 하는 상황,우리 팀이 함께 모여서 회식하는 것은 정말 즐거운 경험입니다.,Non-Sarcasm,이 문장은 팀워크와 회식의 긍정적인 측면을 진정으로 표현하고 있어 비풍자적입니다.
정치적 인물의 지지율이 예상 외로 상승한 상황,이번 지지율 상승은 많은 유권자들이 그의 정책을 긍정적으로 평가하고 있다는 것을 보여줍니다.,Non-Sarcasm,"정치적 인물의 지지율 상승을 긍정적으로 해석하고, 그 이유를 정책 평가로 설명하고 있어 비풍자적입니다."
경찰이 사건의 명확한 증거 없이 사고사로 결론을 내린 상황,경찰의 결론이 다소 섣부르게 느껴진다.,Non-Sarcasm,"이 문장은 경찰의 결론에 대한 진지한 우려를 표현하고 있으며, 비꼬거나 풍자하는 의도가 없다."
누군가에 의존하여 행복을 느끼는 상황,그 사람과 함께할 때마다 정말 행복한 기분이 들어.,Non-Sarcasm,이 문장은 누군가와의 관계에서 진정한 행복을 느낀다는 긍정적인 감정을 표현하고 있어 비풍자적입니다.
qm6 차량의 성능이 기대에 미치지 못하는 상황,qm6 차량의 성능이 예상보다 낮아 실망스럽습니다.,Non-Sarcasm,이 문장은 차량의 성능에 대한 진솔한 평가를 표현하고 있어 비풍자적입니다.
"시어머니가 귀신을 볼 정도로 예리하고 무서운데, 그 남자는 그보다 더 이상하고 무서운 상황",그 남자랑 있으면 귀신도 도망가겠다.,Sarcasm,"귀신도 도망간다는 표현은 그 남자가 실제로 무서운 것이 아니라, 상황이 과장되어 표현된 것이기 때문에 반어적이다."
자신의 몫이나 이익이 모두 다른 사람에게 넘어간 상황,나는 이번 기회에 다른 사람에게 도움을 줄 수 있어서 기쁘다.,Non-Sarcasm,"이 문장은 상황을 긍정적으로 받아들이고, 다른 사람을 돕는 것에 대한 진정한 기쁨을 표현하고 있기 때문에 비풍자적이다."
"사용자가 본 영화가 재미없고 실망스러웠다고 느끼고 있으며, 다른 사람들이 이 영화를 칭찬하는 것에 대해 의문을 제기하고 있다.","이 영화는 많은 사람들에게 인기가 있지만, 개인의 취향에 따라 다르게 느껴질 수 있습니다.",Non-Sarcasm,"이 문장은 영화에 대한 개인적인 의견을 존중하며, 다른 사람들의 반응을 이해하려는 태도를 보여주기 때문에 비풍자적입니다."
어떤 사람들이 자신을 구해준 사람에게 감사 인사를 하지 않는 상황,구해준 사람에게 감사 인사를 하지 않는 건 요즘 유행인가 봐요. 덕분에 인사말을 절약할 수 있어서 참 다행이네요!,Sarcasm,"감사 인사를 하지 않는 행동을 긍정적으로 묘사하며 비꼬는 어조로 표현하여, 실제로는 그 행동이 부적절하다는 것을 암시하고 있다."
상대방이 무언가 심각한 일이나 슬픈 상황에 처해 있는 상황,당신이 겪고 있는 일이 정말 힘들 것 같아요. 제가 도와줄 수 있는 게 있다면 언제든지 말씀해 주세요.,Non-Sarcasm,이 문장은 상대방의 감정을 진지하게 이해하고 지지하는 내용을 담고 있어 비풍자적입니다.
정당 개혁이 필요하다는 주장과 국민의 반대를 억누르려는 정부의 태도가 대립하는 상황,"아, 역시 민주주의의 꽃은 정부의 의견에 무조건 동의하는 것인가 봐요!",Sarcasm,정부의 의견에 무조건 동의하는 것이 민주주의의 본질이 아니라는 점을 비꼬며 반어적으로 표현하고 있기 때문이다.
이직을 고려하고 있지만 이미 기회를 놓친 상황,"이직 기회가 지나갔으니, 지금이라도 타임머신을 개발해볼까?",Sarcasm,"타임머신 개발은 비현실적인 제안으로, 이직 기회를 놓친 상황에 대한 실망감을 비꼬는 표현이다."
회사에서 예상치 못한 문제나 어려운 과제가 발생한 상황,"와, 숨겨진 보스가 등장하다니! 다음엔 아마 외계인 침공이 있을까 봐 두근거리네요. 코딩팀이 아니라서 다행이라고 생각했지만, 사실 우리 팀도 그리 다르지 않다는 걸 깨달았어요. 마치 코딩팀의 고통을 원격으로 체험하는 느낌이랄까요.",Sarcasm,현실의 어려움을 과장하여 외계인 침공 같은 비현실적인 상황을 언급함으로써 상황의 심각성을 비꼬고 있다.
정부가 오랫동안 미뤄왔던 사건에 대해 갑자기 수사를 진행하라는 압박을 받는 상황,정부는 이제라도 사건 수사를 시작해야 한다.,Non-Sarcasm,이 문장은 사건 수사의 필요성을 진지하게 강조하고 있어 비풍자적입니다.
교회에서 신도들이 전도를 통해 자신의 신앙적 성취를 높인다고 믿는 상황,그렇다면 천국은 아마도 가장 큰 교회 건축 경연 대회가 열리는 곳일지도 모르겠네요.,Sarcasm,"천국을 교회 건축 경연 대회와 연결짓는 것은 신앙적 성취를 비꼬는 표현으로, 실제로는 그 개념이 부조리하다는 것을 지적하고 있다."
영화의 초반은 좋았으나 후반부로 갈수록 내용이 산만해지는 상황,"영화의 초반부는 정말 흥미로웠지만, 후반부는 스토리가 흐트러져 아쉬웠습니다.",Non-Sarcasm,이 문장은 영화의 초반과 후반에 대한 실제 감정을 표현하고 있어 비풍자적입니다.
무더운 날씨에 소소자매가 즐겁게 시간을 보내는 상황,"오늘은 날씨가 정말 덥지만, 우리는 시원한 음료를 마시며 즐거운 시간을 보내고 있어.",Non-Sarcasm,"문장에서 날씨가 덥다는 사실을 인정하면서도, 그 속에서 즐거움을 찾고 있다는 긍정적인 태도를 표현하고 있기 때문에 비풍자적이다."
국민들이 정치적 상황에 무관심한 상황,정치에 대한 관심을 높이기 위한 교육과 정보 제공이 필요합니다.,Non-Sarcasm,이 문장은 실제로 정치적 관심을 높이기 위한 진지한 제안을 하고 있어 비풍자적입니다.
짝사랑하는 상황,사랑은 혼자 하는 게 제일 편하죠. 상대방이 몰라도 전혀 문제 없어요!,Sarcasm,사랑은 본래 두 사람 간의 감정이므로 혼자 하는 것이 편하다는 말은 사랑의 본질을 비꼬는 표현이다.
"온라인 쇼핑에서 옷을 구매했는데, 품질이 좋지 않고 배송이 지연된 상황","이번에 구매한 옷은 품질이 기대 이하였고, 배송도 늦어져서 매우 실망스러웠습니다.",Non-Sarcasm,구매한 제품의 품질과 배송 문제에 대한 진솔한 불만을 표현하고 있어 비풍자적입니다.
"언론이 사회 혼란을 조장하고 있으며, 국민의 건강권이 중요하다고 주장하는 상황",언론은 사회의 안정과 국민의 건강을 고려하여 책임 있는 보도를 해야 합니다.,Non-Sarcasm,"이 문장은 언론의 책임을 강조하며, 국민의 건강권을 진지하게 다루고 있어 비풍자적입니다."
물건을 수리 또는 교체하기 위해 보냈는데 시간이 오래 걸리는 상황,"한 달이면 뭐, 우주여행 갔다 오는 시간인가 보죠?",Sarcasm,"우주여행이 실제로는 훨씬 더 긴 시간이 걸리므로, 한 달의 대기 시간을 과장하여 비꼬는 표현이다."
결혼 생활의 초기 갈등과 조정의 과정,서로의 차이를 이해하고 존중하는 것이 결혼 생활을 더욱 건강하게 만들어 줍니다.,Non-Sarcasm,"이 문장은 결혼 생활에서의 갈등 해결을 진지하게 다루고 있으며, 긍정적인 조언을 제공하고 있습니다."
어떤 사건이나 상황에서 비합리적이거나 이해할 수 없는 행동을 목격한 상황,"그 사람의 행동은 정말 이해할 수 없었지만, 아마 그에게는 특별한 이유가 있었을지도 모른다.",Non-Sarcasm,"이 문장은 비합리적인 행동에 대해 이해하려는 노력을 나타내며, 비난이 아닌 공감을 표현하고 있기 때문에 비풍자적이다."
손님이 직설적으로 말해서 마음이 상한 상황,"아, 손님이 친절하게도 내 마음을 깨뜨려 주시네. 역시 고객은 왕이라더니, 왕의 직설은 언제나 감사해야지!",Sarcasm,"반응에서 손님의 직설적인 말이 마음을 상하게 했다는 사실을 비꼬며, 고객이 왕이라는 표현을 과장하여 사용함으로써 실제로는 불만을 드러내고 있다."
아이돌 멤버의 얼굴을 자주 봤지만 이름을 잊은 상황,"그 아이돌 멤버의 얼굴은 정말 익숙한데, 이름이 기억나지 않아서 아쉬워요.",Non-Sarcasm,"이 문장은 진정한 감정을 표현하고 있으며, 이름을 잊은 것에 대한 아쉬움을 솔직하게 전달하고 있습니다."
제품을 주문했는데 잘못된 상품이 배송된 상황,"다음번엔 세탁기와 함께 구매해야겠네요, 혹시 모르니까요!",Sarcasm,"잘못된 상품이 배송된 상황에서 세탁기와 함께 구매하라는 말은 실제로는 불필요한 조언으로, 상황을 비꼬는 의미로 사용되었다."
음식점에서 오이를 추가로 요청하는 상황,오이를 추가로 주실 수 있나요?,Non-Sarcasm,이 문장은 단순히 오이를 추가로 요청하는 진지한 질문이기 때문에 비풍자적입니다.
"사용자가 제품 사용에 불편함을 느끼고 있으며, 제품의 기능이 기대에 미치지 못하고 있음.",고객님의 소중한 의견을 반영하여 제품 개선에 최선을 다하겠습니다.,Non-Sarcasm,고객의 불만을 진지하게 받아들이고 개선 의지를 표현한 문장이기 때문에 비풍자적입니다.
정부가 시민의 안전을 이유로 과도한 통제를 시도하는 상황,"아, 맞아요. 이제는 한강에서 자유롭게 노는 것도 사치인가 보네요. 그저 안전을 위해 집 안에만 콕 박혀 있으라는 거죠. 물론 세금은 더 많이 내야겠지만요!",Sarcasm,"반응은 정부의 과도한 통제를 비꼬며, 시민의 자유가 제한되는 상황을 풍자적으로 표현하고 있어 진지한 의견이 아닌 비꼬는 어조를 사용하고 있습니다."
영화가 기대에 미치지 못하고 재미없었던 상황,"와, 이 영화는 시간과 돈을 효율적으로 낭비하는 완벽한 방법을 알려주네요!",Sarcasm,"영화가 재미없었다는 부정적인 맥락에서, '완벽한 방법'이라는 표현은 실제로는 그 영화의 실패를 조롱하는 의미로 사용되었기 때문에 반어적이다."
정부나 정치인들이 국민들로부터 많은 비판을 받고 있는 상황,"정부는 국민의 목소리를 귀 기울여 듣고, 더 나은 정책을 마련해야 합니다.",Non-Sarcasm,이 문장은 정부가 비판을 받아들이고 개선의 필요성을 인정하는 진지한 제안이기 때문에 비풍자적입니다.
과거의 컴퓨터 기술과 미디어 소비 방식에 대한 회상,"과거에는 컴퓨터가 지금보다 훨씬 느리고, 인터넷 속도도 느려서 웹사이트를 로딩하는 데 시간이 많이 걸렸습니다.",Non-Sarcasm,"이 문장은 과거의 기술적 한계를 사실적으로 설명하고 있으며, 과거와 현재의 차이를 진지하게 회상하고 있습니다."
작은 기업에서 인사와 총무를 겸직하며 다양한 업무를 수행하는 상황,작은 기업에서 인사와 총무를 맡으면서 여러 가지 일을 하게 되어 매우 보람을 느낍니다.,Non-Sarcasm,"이 문장은 긍정적인 감정을 표현하며, 실제로 일에 대한 만족감을 나타내고 있기 때문에 비풍자적입니다."
오랜만에 트위터 계정을 운영하는 홍보실 온라인팀이 회식을 하는 상황,백만년 만에 트위터 운영하느라 고생했으니 이제는 회식으로 손가락 운동 좀 해야겠네요!,Sarcasm,"트위터 운영이 힘들다는 진지한 의미가 아닌, 회식이 손가락 운동과 같다는 비꼬는 표현으로 사용되었기 때문입니다."
급하게 물건을 샀는데 기대했던 만큼 고급스러워 보이지 않는 상황,급하게 사면 고급스러움은 포기해야 한다는 새로운 진리를 깨달았네요!,Sarcasm,고급스러움을 포기해야 한다는 말은 실제로는 급하게 사는 것이 좋지 않다는 것을 비꼬는 표현이다.
인형의 품질에 문제가 있는 상황,"아, 아이들이 실을 먹는 새로운 다이어트를 시작할 수 있겠네요. 건강에 좋지는 않겠지만, 창의력은 높아지겠어요!",Sarcasm,"인형의 품질 문제를 비꼬아, 실을 먹는 것이 다이어트와 창의력에 좋다는 말은 실제로는 부정적인 상황을 풍자하고 있다."
음식을 과도하게 사서 집에 쌓아두고 계속해서 먹는 상황,이 정도면 집에 작은 슈퍼마켓을 차려도 되겠어요. 이제 손님만 오면 되겠네요!,Sarcasm,"실제로는 음식이 과도하게 쌓여 있는 상황을 비꼬아, 슈퍼마켓을 차릴 정도라는 표현으로 상황의 부조리를 강조하고 있기 때문입니다."
